Centon 32 GB USB 2.0 Datastick Pro2,$14.99
Centon 32 GB USB 2.0 Datastick Pro2,$14.99
Centon 32 GB USB 2.0 Datastick Pro2,$14.99
Wicked Audio Bandido Bluetooth Earbud BLK,$27.99
Wicked Audio Bandido Bluetooth Earbud  Blue,$27.99
OnHand Wireless Charging Base,$9.99
Logitech MK320 Wireless Mouse and Keyboard Set,$37.99
Professional Cable 25' Coax Cable,$9.99
Professional Cable 10' USB A-B Device Cable,$8.99
OnHand 5 FT Lightning Cable Pink,$18.99
Centon 32GB USB 2.0 Pro2 Grey,$14.99
iHome Portable Bluetooth Speaker,$55.99
Logitech M325 Wireless Mouse Silver,$32.99
OnHand 5 FT Lightning Cable Green,$18.99
Skullcandy Sesh Evo True Wireless Earbuds Black,CHECK PRICE IN CART
Skullcandy Sesh Evo True Wireless Earbuds Bleach Blue,CHECK PRICE IN CART
LXG 2-in-1 Lightning/Micro Cable,$19.99
Targus Kb55 Multi Platform Wireless Bluetooth Keyboard In Black,$23.99
JBL Tune 225 True Wireless Earbuds,CHECK PRICE IN CART
3 Outlet Wall Tap w/ 2 USB Ports,$24.98
Laut Airpod Case White,$4.99
iHome Slim Wall Charger White,$9.99
JBL Flip 5 Bluetooth Speaker Gray,CHECK PRICE IN CART
JBL Pulse 4 Wireless Speaker,CHECK PRICE IN CART
OTM Essentials HD Pro Webcam,$32.99
JBL GO3 Wireless Speaker Black,CHECK PRICE IN CART
iHome Slim Wall Charger Green,$9.99
Native Union Lightning Cable Keychain,$14.99
JBL CLIP4 Wireless Speaker,CHECK PRICE IN CART
Altec Rockbox Mini Bluetooth Speaker,$122.99
Coax Cable 6ft,$4.99
Nanobud Sport TWS Earbuds w/charging case,$46.99
JBL Tune 230 True Wireless Noise Cancelling InEarEarbuds- Black,CHECK PRICE IN CART
"JBL Live Free 2 True Wireless Noise Cancelling In-Ear Earbuds, Black",CHECK PRICE IN CART
JBL Live Free 2 True Wireless Noise Cancelling In-Ear Earbuds- Silver,CHECK PRICE IN CART
"OnHand Audio Adapter USB-C to 3.5mm, Black",$12.99
Adesso Antimicrobial Wireless Mouse,$28.99
Logitech M525 Wireless Laser Mouse Black/Navy,$32.99
Portable Super Slim Fast Charge Powerbank- Black.,$17.99
Portable Super Slim Fast Charge Powerbank- White.,$22.99
Portable Super Slim Fast Charge Powerbank- Black.,$22.99
"PopSockets MagSafe PopGrip, Neon Pink",$26.99
"PopSockets MagSafe PopGrip, Black",$26.99
"PopSockets MagSafe PopGrip, Gold Lutz Marble",$26.99
JBL Tune 230NC True Wireless Noise Cancelling In-Ear Headphones- White,CHECK PRICE IN CART
"PopSockets MagSafe PopGrip, Blue Nebula",$26.99
JBL CLIP4 Wireless Speaker,CHECK PRICE IN CART
JBL Live Free True Wireless Noise Canceling In-Ear Earbud White,CHECK PRICE IN CART
JBL Live Free True Wireless Noise Canceling In-Ear Earbud Black,CHECK PRICE IN CART
JBL Flip 5 ECO Wireless Speaker,CHECK PRICE IN CART
"JBL Flip 5 Eco Wireless Speaker, Forest Green",CHECK PRICE IN CART
Skullcandy Push Active True Wireless Earbuds-  True Black/Orange,CHECK PRICE IN CART
JBL Tune 225 True Wireless Earbuds,CHECK PRICE IN CART
iHome PlayGlow Mini Rechargeable Bluetooth Speaker,$38.99
Beats Studio Buds   True Wireless Noise Cancelling Earphones,CHECK PRICE IN CART
Beats Studio Buds Totally Wireless Active Noise Cancelling Headphone,CHECK PRICE IN CART
Nanobud Sport TWS Earbuds w/charging case -Anti-Microbial,$46.99
"Ohio State University Leather Shell Phone Case, Black, Alumni V2 - iPhone 13",$22.99
"Ohio State University Buckeyes Clear Tough Edge Phone Case, Classic- iPhone 13 Pro",$17.99
JLab JBuds Mini True Wireless Earbuds- Mint,CHECK PRICE IN CART
Jlab Go Air POP True Wireless Earbuds Slate,CHECK PRICE IN CART
Flowtag Digital Contact Card,$13.99
Jlab Go Air POP True Wireless Earbuds Lilac,CHECK PRICE IN CART
Flowtag Digital Contact Card,$13.99
Flowtag Digital Contact Card,$13.99
Portable Super Slim Fast Charge Powerbank- White.,$17.99
Portable Super Slim Fast Charge Powerbank- Pink.,$17.99
JLab Go Air Sport True Wireless Earbuds- Green,CHECK PRICE IN CART
iHome Alarm Clock with Qi Wireless Charging and USB Charging,CHECK PRICE IN CART
Jlab Go Air Sport True Wireless Earbuds- Black,CHECK PRICE IN CART
Scosche BoomCan MagSafe Magnetic Wireless Speaker- White,CHECK PRICE IN CART
iHome PowerValet Quad+ Alarm Clock with Wireless Charging,CHECK PRICE IN CART
Scosche BoomCan MagSafe Magnetic Wireless Speaker- Black,CHECK PRICE IN CART
iHome Bluetooth Alarm Clock with USB Charging,CHECK PRICE IN CART
Flowtag Digital Contact Card,$13.99
JLAB Hearing Protection Earplugs,CHECK PRICE IN CART
JLab GO Air POP True Wireless Earbuds- Teal,CHECK PRICE IN CART
